{
  "schema_version": 1,
  "source": "White Labs",
  "upstream": "https://www.whitelabs.com/yeast-bank",
  "generated_at": "2026-10-26T15:13:25Z",
  "entries": [
    {
      "url": "https://www.whitelabs.com/yeast-single?id=101&type=YEAST",
      "strain": "WLP001",
      "name": "California Ale Yeast",
      "attenuation_text": "73% - 85%",
      "attenuation_low_pct": 73.0,
      "attenuation_high_pct": 85.0,
      "attenuation_basis": "apparent",
      "flocculation": "Medium",
      "alcohol_tolerance": "Medium (5-10%)",
      "temp_low_c": 18.0,
      "temp_high_c": 23.0,
      "sta1_text": "Negative",
      "sta1": false,
      "retrieved_at": "2026-10-26T15:08:16Z",
      "sha256": "c876822803decc461321accefa9eae5e9fa8de6f2c1dd917ea16c8cf788c4796"
    },
    {
      "url": "https://www.whitelabs.com/yeast-single?id=102&type=YEAST",
      "strain": "WLP002",
      "name": "English Ale Yeast",
      "attenuation_text": "63% - 70%",
      "attenuation_low_pct": 63.0,
      "attenuation_high_pct": 70.0,
      "attenuation_basis": "apparent",
      "flocculation": "Very High",
      "alcohol_tolerance": "Medium (5-10%)",
      "temp_low_c": 18.0,
      "temp_high_c": 20.0,
      "sta1_text": "Negative",
      "sta1": false,
      "retrieved_at": "2026-10-26T15:08:18Z",
      "sha256": "59e08094449104eafed1c851eb9c1e1e3fc11e18eb0d07a354c898b2b3587af6"
    },
    {
      "url": "https://www.whitelabs.com/yeast-single?id=103&type=YEAST",
      "strain": "WLP003",
      "name": "German Ale II Yeast",
      "attenuation_text": "73% - 80%",
      "attenuation_low_pct": 73.0,
      "attenuation_high_pct": 80.0,
      "attenuation_basis": "apparent",
      "flocculation": "Medium",
      "alcohol_tolerance": "Medium (5-10%)",
      "temp_low_c": 18.0,
      "temp_high_c": 21.0,
      "sta1_text": "Negative",
      "sta1": false,
      "retrieved_at": "2026-10-26T15:08:19Z",
      "sha256": "3107659ee0cb8650e013e8c6198195fc77bc66ad6d962ede13514d23bac4595a"
    },
    {
      "url": "https://www.whitelabs.com/yeast-single?id=104&type=YEAST",
      "strain": "WLP004",
      "name": "Irish Ale Yeast",
      "attenuation_text": "69% - 74%",
      "attenuation_low_pct": 69.0,
      "attenuation_high_pct": 74.0,
      "attenuation_basis": "apparent",
      "flocculation": "Medium to High",
      "alcohol_tolerance": "Medium (5-10%)",
      "temp_low_c": 18.0,
      "temp_high_c": 20.0,
      "sta1_text": "Negative",
      "sta1": false,
      "retrieved_at": "2026-10-26T15:08:20Z",
      "sha256": "5739268779d69e3199ace7c48e12e30ce9498947f419706787a976bebe16764a"
    },
    {
      "url": "https://www.whitelabs.com/yeast-single?id=105&type=YEAST",
      "strain": "WLP005",
      "name": "British Ale Yeast",
      "attenuation_text": "67% - 74%",
      "attenuation_low_pct": 67.0,
      "attenuation_high_pct": 74.0,
      "attenuation_basis": "apparent",
      "flocculation": "High",
      "alcohol_tolerance": "Medium (5-10%)",
      "temp_low_c": 18.0,
      "temp_high_c": 21.0,
      "sta1_text": "Negative",
      "sta1": false,
      "retrieved_at": "2026-10-26T15:08:22Z",
      "sha256": "6813a3ef388dc9f25279259664bfe3dbe3bbf9931bc224c2dbeba78301dac206"
    },
    {
      "url": "https://www.whitelabs.com/yeast-single?id=106&type=YEAST",
      "strain": "WLP006",
      "name": "Bedford British Ale Yeast",
      "attenuation_text": "72% - 80%",
      "attenuation_low_pct": 72.0,
      "attenuation_high_pct": 80.0,
      "attenuation_basis": "apparent",
      "flocculation": "High",
      "alcohol_tolerance": "Medium (5-10%)",
      "temp_low_c": 18.0,
      "temp_high_c": 21.0,
      "sta1_text": "Negative",
      "sta1": false,
      "retrieved_at": "2026-10-26T15:08:23Z",
      "sha256": "c81a23973d4e59c36248ac0f01ac045e94934c137a839321a9790fa4b23bf794"
    },
    {
      "url": "https://www.whitelabs.com/yeast-single?id=107&type=YEAST",
      "strain": "WLP007",
      "name": "Crisp English Ale Yeast",
      "attenuation_text": "70% - 80%",
      "attenuation_low_pct": 70.0,
      "attenuation_high_pct": 80.0,
      "attenuation_basis": "apparent",
      "flocculation": "Medium to High",
      "alcohol_tolerance": "Medium (5-10%)",
      "temp_low_c": 18.0,
      "temp_high_c": 21.0,
      "sta1_text": "Negative",
      "sta1": false,
      "retrieved_at": "2026-10-26T15:08:25Z",
      "sha256": "555f20953903ff1af71a0ac30b63ef42d77211af71882e90c2be1d7253b4e5d5"
    },
    {
      "url": "https://www.whitelabs.com/yeast-single?id=108&type=YEAST",
      "strain": "WLP008",
      "name": "East Coast Ale Yeast",
      "attenuation_text": "70% - 75%",
      "attenuation_low_pct": 70.0,
      "attenuation_high_pct": 75.0,
      "attenuation_basis": "apparent",
      "flocculation": "Low to Medium",
      "alcohol_tolerance": "Medium (5-10%)",
      "temp_low_c": 20.0,
      "temp_high_c": 23.0,
      "sta1_text": "Negative",
      "sta1": false,
      "retrieved_at": "2026-10-26T15:08:26Z",
      "sha256": "6f92180b380085cde1baf551ec942132e328e7fe9175b9ecc5b8bd9783fbb67e"
    },
    {
      "url": "https://www.whitelabs.com/yeast-single?id=109&type=YEAST",
      "strain": "WLP009",
      "name": "Australian Ale Yeast",
      "attenuation_text": "70% - 75%",
      "attenuation_low_pct": 70.0,
      "attenuation_high_pct": 75.0,
      "attenuation_basis": "apparent",
      "flocculation": "High",
      "alcohol_tolerance": "Medium (5-10%)",
      "temp_low_c": 18.0,
      "temp_high_c": 21.0,
      "sta1_text": "Negative",
      "sta1": false,
      "retrieved_at": "2026-10-26T15:08:27Z",
      "sha256": "862c26381d0a1c48a336ff42167c18a40f26a1346ba801a644a92763af0920f2"
    },
    {
      "url": "https://www.whitelabs.com/yeast-single?id=110&type=YEAST",
      "strain": "WLP011",
      "name": "European Ale Yeast",
      "attenuation_text": "65% - 70%",
      "attenuation_low_pct": 65.0,
      "attenuation_high_pct": 70.0,
      "attenuation_basis": "apparent",
      "flocculation": "Medium",
      "alcohol_tolerance": "Medium (5-10%)",
      "temp_low_c": 18.0,
      "temp_high_c": 21.0,
      "sta1_text": "Negative",
      "sta1": false,
      "retrieved_at": "2026-10-26T15:08:29Z",
      "sha256": "b1eb2e41798a41e77fb96d52439b02b5b9f91a5207935476382159cbb5fb9480"
    },
    {
      "url": "https://www.whitelabs.com/yeast-single?id=111&type=YEAST",
      "strain": "WLP013",
      "name": "London Ale Yeast",
      "attenuation_text": "67% - 75%",
      "attenuation_low_pct": 67.0,
      "attenuation_high_pct": 75.0,
      "attenuation_basis": "apparent",
      "flocculation": "Medium",
      "alcohol_tolerance": "Medium to High (8-12%)",
      "temp_low_c": 19.0,
      "temp_high_c": 22.0,
      "sta1_text": "Negative",
      "sta1": false,
      "retrieved_at": "2026-10-26T15:08:30Z",
      "sha256": "bf83f747118d8d720ee2f9d0e9a9c71b04997c8df06b1f94973ef289bb61e2fc"
    },
    {
      "url": "https://www.whitelabs.com/yeast-single?id=112&type=YEAST",
      "strain": "WLP017",
      "name": "Whitbread II Ale Yeast",
      "attenuation_text": "67% - 73%",
      "attenuation_low_pct": 67.0,
      "attenuation_high_pct": 73.0,
      "attenuation_basis": "apparent",
      "flocculation": "High",
      "alcohol_tolerance": "Medium (5-10%)",
      "temp_low_c": 19.0,
      "temp_high_c": 21.0,
      "sta1_text": "Negative",
      "sta1": false,
      "retrieved_at": "2026-10-26T15:08:32Z",
      "sha256": "7b8325bdb6a858686f0d6d43eb7867f6ee9dd15e869dee01c3f0fa44e441efcf"
    },
    {
      "url": "https://www.whitelabs.com/yeast-single?id=114&type=YEAST",
      "strain": "WLP022",
      "name": "Essex Ale Yeast",
      "attenuation_text": "71% - 76%",
      "attenuation_low_pct": 71.0,
      "attenuation_high_pct": 76.0,
      "attenuation_basis": "apparent",
      "flocculation": "Medium to High",
      "alcohol_tolerance": "Medium (5-10%)",
      "temp_low_c": 19.0,
      "temp_high_c": 21.0,
      "sta1_text": "Negative",
      "sta1": false,
      "retrieved_at": "2026-10-26T15:08:34Z",
      "sha256": "6f78c5393c503b14ece60d8b27f54ae2762c606cdbe9973dc439cc64d1020cb4"
    },
    {
      "url": "https://www.whitelabs.com/yeast-single?id=115&type=YEAST",
      "strain": "WLP023",
      "name": "Burton Ale Yeast",
      "attenuation_text": "72% - 78%",
      "attenuation_low_pct": 72.0,
      "attenuation_high_pct": 78.0,
      "attenuation_basis": "apparent",
      "flocculation": "Medium",
      "alcohol_tolerance": "Medium (5-10%)",
      "temp_low_c": 20.0,
      "temp_high_c": 23.0,
      "sta1_text": "Negative",
      "sta1": false,
      "retrieved_at": "2026-10-26T15:08:36Z",
      "sha256": "932d35edf2e912f568f32c3246acf2e1eee69424e695bc0216cd8ca12ad387e5"
    },
    {
      "url": "https://www.whitelabs.com/yeast-single?id=116&type=YEAST",
      "strain": "WLP025",
      "name": "Southwold Ale Yeast",
      "attenuation_text": "68% - 75%",
      "attenuation_low_pct": 68.0,
      "attenuation_high_pct": 75.0,
      "attenuation_basis": "apparent",
      "flocculation": "Medium",
      "alcohol_tolerance": "Medium (5-10%)",
      "temp_low_c": 19.0,
      "temp_high_c": 20.0,
      "sta1_text": "Negative",
      "sta1": false,
      "retrieved_at": "2026-10-26T15:08:37Z",
      "sha256": "8d2f032b9c589858090582737a728d82105871311f2972ae3f4f843532cb5ab5"
    },
    {
      "url": "https://www.whitelabs.com/yeast-single?id=117&type=YEAST",
      "strain": "WLP026",
      "name": "Premium Bitter Ale Yeast",
      "attenuation_text": "70% - 75%",
      "attenuation_low_pct": 70.0,
      "attenuation_high_pct": 75.0,
      "attenuation_basis": "apparent",
      "flocculation": "Medium",
      "alcohol_tolerance": "Medium (5-10%)",
      "temp_low_c": 19.0,
      "temp_high_c": 21.0,
      "sta1_text": "Positive",
      "sta1": true,
      "retrieved_at": "2026-10-26T15:08:39Z",
      "sha256": "6d4c4388a8471fd6d524cdac6a57ff73386afa90c724fb36157d7aabd8c7308d"
    },
    {